{
  "schema_version": "p2a.context_routes.v1",
  "providers": [
    "codex",
    "claude",
    "gemini"
  ],
  "skills": [
    {
      "id": "p2a-harness",
      "stages": [
        "entry",
        "gate-a",
        "gate-shape",
        "gate-b"
      ],
      "gemini_command": "harness",
      "references": [
        {
          "id": "harness.project-shape-approvals",
          "path": "references/project-shape-and-approvals.md",
          "phases": [],
          "load": "on-demand",
          "required": true,
          "condition": "Gate A approval, a material Gate ② project-shape decision, or Gate B approval must be proposed or recorded.",
          "stages": [
            "gate-a",
            "gate-shape",
            "gate-b"
          ]
        },
        {
          "id": "harness.artifact-persistence-evidence",
          "path": "references/artifact-persistence-and-evidence.md",
          "phases": [],
          "load": "on-demand",
          "required": true,
          "condition": "Canonical planning state is about to be persisted, projected to status, or handed off.",
          "stages": [
            "gate-a",
            "gate-shape",
            "gate-b"
          ]
        },
        {
          "id": "harness.existing-documents",
          "path": "references/existing-documents.md",
          "phases": [],
          "load": "conditional",
          "required": true,
          "condition": "The entry has a validated reference bundle, or the entry or active iteration points to an existing PRD, design, implementation plan, or approved Plan2Agent baseline.",
          "stages": [
            "entry",
            "gate-a",
            "gate-b"
          ]
        },
        {
          "id": "harness.buildlore-knowledge",
          "path": "references/buildlore-knowledge.md",
          "phases": [],
          "load": "conditional",
          "required": false,
          "condition": "BuildLore is configured and committed project knowledge is relevant to Gate A, Gate B, or Orchestrated decomposition.",
          "stages": [
            "gate-a",
            "gate-b"
          ]
        }
      ]
    },
    {
      "id": "p2a-next",
      "stages": [
        "entry",
        "gate-a",
        "gate-shape",
        "gate-b",
        "gate-c",
        "execution",
        "closeout"
      ],
      "gemini_command": "next",
      "references": [
        {
          "id": "next.closeout-choices",
          "path": "references/closeout-choices.md",
          "source_skill": "p2a-dev-execution",
          "phases": [],
          "load": "conditional",
          "required": true,
          "condition": "A closeout choice or an explicit review/retrospective/report/issue request is being handled.",
          "stages": [
            "closeout"
          ]
        }
      ]
    },
    {
      "id": "p2a-spec",
      "stages": [
        "gate-b"
      ],
      "gemini_command": "spec",
      "references": [
        {
          "id": "spec.contract",
          "path": "references/spec-contract.md",
          "phases": [],
          "load": "on-demand",
          "required": true,
          "condition": "A Gate B specification is about to be authored or validated.",
          "stages": [
            "gate-b"
          ]
        },
        {
          "id": "spec.technology-reconnaissance",
          "path": "references/technology-reconnaissance.md",
          "phases": [],
          "load": "conditional",
          "required": true,
          "condition": "A material external technology or reusable implementation choice may be stale, current-version-sensitive, or consequential.",
          "stages": [
            "gate-b"
          ]
        },
        {
          "id": "spec.baseline-buildlore",
          "path": "references/baseline-and-buildlore.md",
          "phases": [],
          "load": "conditional",
          "required": true,
          "condition": "The intake carries a validated baseline, a prior spec is reused, or relevant BuildLore knowledge exists.",
          "stages": [
            "gate-b"
          ]
        },
        {
          "id": "spec.entry-reference-bundle",
          "path": "references/entry-reference-bundle.md",
          "phases": [],
          "load": "conditional",
          "required": true,
          "condition": "The validated entry has a p2a-reference-bundle.json with material evidence for Gate B.",
          "stages": [
            "gate-b"
          ]
        },
        {
          "id": "spec.markdown-views",
          "path": "references/markdown-views.md",
          "phases": [],
          "load": "conditional",
          "required": false,
          "condition": "A human-readable product or implementation view is requested or needed for review.",
          "stages": [
            "gate-b"
          ]
        }
      ]
    },
    {
      "id": "p2a-task-author",
      "modes": [
        "orchestrated"
      ],
      "stages": [
        "gate-c"
      ],
      "gemini_command": "task-author",
      "references": [
        {
          "id": "task-author.draft-contract",
          "path": "references/draft-contract.md",
          "phases": [],
          "load": "on-demand",
          "required": true,
          "condition": "A new Gate C task graph draft is about to be authored from validated task context.",
          "stages": [
            "gate-c"
          ]
        },
        {
          "id": "task-author.replacement-promotion",
          "path": "references/replacement-and-promotion.md",
          "phases": [],
          "load": "conditional",
          "required": true,
          "condition": "A canonical graph already exists, or a draft is ready for validation and promotion.",
          "stages": [
            "gate-c"
          ]
        }
      ]
    },
    {
      "id": "p2a-task-breakdown",
      "modes": [
        "orchestrated"
      ],
      "stages": [
        "gate-c"
      ],
      "gemini_command": "task-breakdown",
      "references": [
        {
          "id": "task-breakdown.draft-contract",
          "path": "references/draft-contract.md",
          "source_skill": "p2a-task-author",
          "phases": [],
          "load": "on-demand",
          "required": true,
          "condition": "This compatibility entry is about to decompose an approved spec into a task graph.",
          "stages": [
            "gate-c"
          ]
        }
      ]
    },
    {
      "id": "p2a-dev-execution",
      "modes": [
        "direct",
        "planned",
        "orchestrated"
      ],
      "stages": [
        "gate-c",
        "execution",
        "acceptance",
        "monitor",
        "visual",
        "closeout"
      ],
      "gemini_command": "dev-execution",
      "references": [
        {
          "id": "execution.lifecycle",
          "path": "references/execution-lifecycle.md",
          "phases": [
            "prepare",
            "owner-start",
            "retry"
          ],
          "load": "on-demand",
          "required": true,
          "condition": "Gate C is absent and execution needs preparation, or a single-owner run is about to start or resume.",
          "stages": [
            "gate-c",
            "execution"
          ]
        },
        {
          "id": "execution.provider-confinement",
          "path": "references/provider-confinement.md",
          "phases": [
            "owner-start"
          ],
          "load": "on-demand",
          "required": true,
          "condition": "A write-capable owner is about to start or resume implementation.",
          "stages": [
            "execution"
          ]
        },
        {
          "id": "execution.verification-closeout",
          "path": "references/verification-closeout.md",
          "phases": [
            "verify-closeout"
          ],
          "load": "on-demand",
          "required": true,
          "condition": "The implementation outcome is ready for executable verification, checkpointing, or run closeout.",
          "stages": [
            "execution",
            "closeout"
          ]
        },
        {
          "id": "execution.closeout-choices",
          "path": "references/closeout-choices.md",
          "phases": [],
          "load": "conditional",
          "required": true,
          "condition": "A closeout choice or an explicit review/retrospective/report/issue request is being handled.",
          "stages": [
            "closeout"
          ]
        },
        {
          "id": "execution.acceptance-review",
          "path": "references/acceptance-review.md",
          "phases": [
            "acceptance-review"
          ],
          "load": "conditional",
          "required": true,
          "condition": "Acceptance review policy is on, explicitly opted in, or an acceptance run is already active, and no required visual contract replaces it.",
          "stages": [
            "acceptance",
            "closeout"
          ]
        },
        {
          "id": "execution.batch",
          "path": "references/batch-execution.md",
          "phases": [
            "batch"
          ],
          "load": "conditional",
          "required": true,
          "condition": "Two or more independent ready tasks will run concurrently in isolated worktrees.",
          "modes": [
            "orchestrated"
          ],
          "stages": [
            "execution"
          ]
        },
        {
          "id": "execution.monitor-gate",
          "path": "references/monitor-gate.md",
          "phases": [
            "monitor"
          ],
          "load": "conditional",
          "required": true,
          "condition": "The current run was started with --require-monitor.",
          "stages": [
            "monitor",
            "closeout"
          ]
        },
        {
          "id": "execution.visual-evidence",
          "path": "references/visual-evidence.md",
          "phases": [
            "visual-review"
          ],